{
  "version": 2,
  "activation": "disabled",
  "provider": {
    "kind": "spectrum-cloud-imessage",
    "projectId": "replace-project",
    "projectSecretFile": "/absolute/private-root/runtime/project-secret",
    "accountId": "replace-account",
    "lineId": "replace-line",
    "phone": "+15555550101",
    "conversationId": "replace-native-conversation",
    "dedicated": true,
    "availableOperations": [
      "text.send"
    ]
  },
  "local": {
    "socketPath": "/absolute/private-root/runtime/runtime.sock",
    "credentialFile": "/absolute/private-root/runtime/local-token",
    "principalId": "replace-principal",
    "credentialId": "replace-credential"
  },
  "task": {
    "contextId": "replace-context",
    "taskId": "replace-task",
    "generation": 1,
    "permissions": [
      "text.send"
    ],
    "issuedAt": 1789257600000,
    "expiresAt": 1789261200000,
    "grokAgentId": "replace-existing-agent"
  },
  "grok": {
    "executable": "/absolute/existing/gbot",
    "timeoutMs": 15000
  },
  "authorization": {
    "administrativeOperations": [],
    "allowedRecipients": [],
    "allowNativeContent": false
  },
  "cards": [],
  "textStreaming": {
    "delivery": "progressive"
  },
  "runtime": {
    "statePath": "/absolute/private-root/runtime/state.sqlite",
    "captureDirectory": "/absolute/private-root/runtime/captures",
    "stagingDirectory": "/absolute/private-root/runtime/staging",
    "importDirectory": "/absolute/private-root/runtime/imports"
  }
}
